{
  "$version": "1.0",
  "$schema": "./taxonomy_report_sector.schema.json",
  "updated_at": "2025-01-01",
  "id_convention": "SCREAMING-KEBAB with SECT- prefix. Sub-sectors prefixed with parent sector ID. e.g. SECT-CIVIL-HEALTH. IDs permanently stable.",
  "description": "Controlled vocabulary for report_sector field in inheritable_audit_metadata.schema. Maps to CAG audit wing structure. Two levels: sector (top-level wing) and sub_sector (functional domain).",
  "usage_notes": [
    "Set sector at report level. Set sub_sector at report or chapter level.",
    "A report may carry multiple sub_sector values but typically one sector.",
    "Civil is the residual sector — if a domain does not fit Commercial, Revenue, Defence, Telecom, or Railways, it belongs under Civil.",
    "Commercial covers audit of entities (PSUs, bodies) — not commercial activities of line departments.",
    "Revenue covers audit of government receipts — not to be confused with the Department of Revenue."
  ],
  "cag_wing_values": [
    "Civil Audit",
    "Commercial Audit",
    "Revenue Audit",
    "Defence Audit",
    "Telecom Audit",
    "Railways Audit"
  ],
  "entries": [
    {
      "id": "SECT-CIVIL",
      "label": { "en": "Civil", "hi": "सिविल" },
      "short_label": { "en": "Civil" },
      "level": "sector",
      "parent_id": null,
      "cag_wing": "Civil Audit",
      "description": { "en": "Audit of civil government expenditure — non-commercial, non-defence, non-revenue, non-telecom, non-railways government spending. Covers social sector, infrastructure, and general administration." },
      "sort_order": 1,
      "deprecated": false,
      "sub_sectors": [
        "SECT-CIVIL-HEALTH",
        "SECT-CIVIL-EDUCATION",
        "SECT-CIVIL-RURAL-DEV",
        "SECT-CIVIL-URBAN-DEV",
        "SECT-CIVIL-AGRICULTURE",
        "SECT-CIVIL-WATER",
        "SECT-CIVIL-FOREST-ENV",
        "SECT-CIVIL-PWD",
        "SECT-CIVIL-SOCIAL-WELFARE",
        "SECT-CIVIL-HOME-POLICE",
        "SECT-CIVIL-FINANCE-TREASURY",
        "SECT-CIVIL-GENERAL-ADMIN"
      ]
    },
    {
      "id": "SECT-CIVIL-HEALTH",
      "label": { "en": "Health and Family Welfare", "hi": "स्वास्थ्य एवं परिवार कल्याण" },
      "short_label": { "en": "Health" },
      "level": "sub_sector",
      "parent_id": "SECT-CIVIL",
      "cag_wing": "Civil Audit",
      "description": { "en": "Audit of health department expenditure, hospital infrastructure, public health programmes, and family welfare schemes. Covers NHM, PMJAY, AYUSH and state health missions." },
      "sort_order": 1,
      "deprecated": false
    },
    {
      "id": "SECT-CIVIL-EDUCATION",
      "label": { "en": "Education", "hi": "शिक्षा" },
      "short_label": { "en": "Education" },
      "level": "sub_sector",
      "parent_id": "SECT-CIVIL",
      "cag_wing": "Civil Audit",
      "description": { "en": "Audit of school education, higher education, and technical education department expenditure. Covers SSA, RMSA, Samagra Shiksha, and state education boards." },
      "sort_order": 2,
      "deprecated": false
    },
    {
      "id": "SECT-CIVIL-RURAL-DEV",
      "label": { "en": "Rural Development and Panchayati Raj", "hi": "ग्रामीण विकास एवं पंचायती राज" },
      "short_label": { "en": "Rural Development" },
      "level": "sub_sector",
      "parent_id": "SECT-CIVIL",
      "cag_wing": "Civil Audit",
      "description": { "en": "Audit of rural development and panchayati raj department expenditure. Covers MGNREGS, PMGSY, PMAY-G, NRLM, and related centrally sponsored schemes." },
      "sort_order": 3,
      "deprecated": false
    },
    {
      "id": "SECT-CIVIL-URBAN-DEV",
      "label": { "en": "Urban Development and Housing", "hi": "नगरीय विकास एवं आवास" },
      "short_label": { "en": "Urban Development" },
      "level": "sub_sector",
      "parent_id": "SECT-CIVIL",
      "cag_wing": "Civil Audit",
      "description": { "en": "Audit of urban development, housing, and municipal affairs. Covers AMRUT, Smart Cities Mission, PMAY-U, and state housing boards." },
      "sort_order": 4,
      "deprecated": false
    },
    {
      "id": "SECT-CIVIL-AGRICULTURE",
      "label": { "en": "Agriculture and Allied Services", "hi": "कृषि एवं संबद्ध सेवाएं" },
      "short_label": { "en": "Agriculture" },
      "level": "sub_sector",
      "parent_id": "SECT-CIVIL",
      "cag_wing": "Civil Audit",
      "description": { "en": "Audit of agriculture, horticulture, animal husbandry, fisheries, and food processing. Covers PM-KISAN, PMFBY, crop insurance, and state agriculture departments." },
      "sort_order": 5,
      "deprecated": false
    },
    {
      "id": "SECT-CIVIL-WATER",
      "label": { "en": "Water Resources and Irrigation", "hi": "जल संसाधन एवं सिंचाई" },
      "short_label": { "en": "Water Resources" },
      "level": "sub_sector",
      "parent_id": "SECT-CIVIL",
      "cag_wing": "Civil Audit",
      "description": { "en": "Audit of irrigation, water resources, flood control, and drinking water supply. Covers dam construction, canal systems, Jal Jeevan Mission, and state water resource departments." },
      "sort_order": 6,
      "deprecated": false
    },
    {
      "id": "SECT-CIVIL-FOREST-ENV",
      "label": { "en": "Forests and Environment", "hi": "वन एवं पर्यावरण" },
      "short_label": { "en": "Forest & Environment" },
      "level": "sub_sector",
      "parent_id": "SECT-CIVIL",
      "cag_wing": "Civil Audit",
      "description": { "en": "Audit of forest departments, wildlife management, environmental protection, and climate change programmes. Covers Forest Conservation Act compliance, CAMPA funds, and pollution control boards." },
      "sort_order": 7,
      "deprecated": false
    },
    {
      "id": "SECT-CIVIL-PWD",
      "label": { "en": "Public Works and Infrastructure", "hi": "लोक निर्माण एवं अवसंरचना" },
      "short_label": { "en": "Public Works" },
      "level": "sub_sector",
      "parent_id": "SECT-CIVIL",
      "cag_wing": "Civil Audit",
      "description": { "en": "Audit of public works departments, road construction, building works, and infrastructure projects. Covers state PWD, NHAI-related state works, and government buildings." },
      "sort_order": 8,
      "deprecated": false
    },
    {
      "id": "SECT-CIVIL-SOCIAL-WELFARE",
      "label": { "en": "Social Welfare, Labour and Tribal Affairs", "hi": "समाज कल्याण, श्रम एवं आदिवासी मामले" },
      "short_label": { "en": "Social Welfare" },
      "level": "sub_sector",
      "parent_id": "SECT-CIVIL",
      "cag_wing": "Civil Audit",
      "description": { "en": "Audit of social welfare, labour welfare, tribal affairs, women and child development, and disability programmes. Covers ICDS, POSHAN, SC/ST welfare schemes, and labour law enforcement." },
      "sort_order": 9,
      "deprecated": false
    },
    {
      "id": "SECT-CIVIL-HOME-POLICE",
      "label": { "en": "Home, Police and Jails", "hi": "गृह, पुलिस एवं कारागार" },
      "short_label": { "en": "Home & Police" },
      "level": "sub_sector",
      "parent_id": "SECT-CIVIL",
      "cag_wing": "Civil Audit",
      "description": { "en": "Audit of home department, police modernisation, jail administration, and internal security expenditure." },
      "sort_order": 10,
      "deprecated": false
    },
    {
      "id": "SECT-CIVIL-FINANCE-TREASURY",
      "label": { "en": "Finance, Revenue and Treasury", "hi": "वित्त, राजस्व एवं कोषागार" },
      "short_label": { "en": "Finance & Treasury" },
      "level": "sub_sector",
      "parent_id": "SECT-CIVIL",
      "cag_wing": "Civil Audit",
      "description": { "en": "Audit of state finance, treasury operations, debt management, pension disbursement, and state revenue from stamps, registration, and excise (non-GST). Distinct from SECT-REVENUE which covers central tax audit." },
      "sort_order": 11,
      "deprecated": false
    },
    {
      "id": "SECT-CIVIL-GENERAL-ADMIN",
      "label": { "en": "General Administration and Services", "hi": "सामान्य प्रशासन एवं सेवाएं" },
      "short_label": { "en": "General Admin" },
      "level": "sub_sector",
      "parent_id": "SECT-CIVIL",
      "cag_wing": "Civil Audit",
      "description": { "en": "Audit of general administration, personnel management, civil services, government printing, and other non-sector-specific administrative functions." },
      "sort_order": 12,
      "deprecated": false
    },
    {
      "id": "SECT-COMMERCIAL",
      "label": { "en": "Commercial", "hi": "वाणिज्यिक" },
      "short_label": { "en": "Commercial" },
      "level": "sector",
      "parent_id": null,
      "cag_wing": "Commercial Audit",
      "description": { "en": "Audit of commercial entities — government companies, PSUs, statutory corporations, autonomous bodies, and externally aided projects." },
      "sort_order": 2,
      "deprecated": false,
      "sub_sectors": [
        "SECT-COMM-PSU-CENTRAL",
        "SECT-COMM-PSU-STATE",
        "SECT-COMM-AUTONOMOUS",
        "SECT-COMM-EAP"
      ]
    },
    {
      "id": "SECT-COMM-PSU-CENTRAL",
      "label": { "en": "Central Public Sector Undertakings", "hi": "केंद्रीय सार्वजनिक उपक्रम" },
      "short_label": { "en": "Central PSUs" },
      "level": "sub_sector",
      "parent_id": "SECT-COMMERCIAL",
      "cag_wing": "Commercial Audit",
      "description": { "en": "Audit of central government companies and corporations under Sections 19 and 19A of the DPC Act. Covers Navratna, Miniratna, and other central PSUs across all sectors." },
      "sort_order": 1,
      "deprecated": false
    },
    {
      "id": "SECT-COMM-PSU-STATE",
      "label": { "en": "State Public Sector Undertakings", "hi": "राज्य सार्वजनिक उपक्रम" },
      "short_label": { "en": "State PSUs" },
      "level": "sub_sector",
      "parent_id": "SECT-COMMERCIAL",
      "cag_wing": "Commercial Audit",